{
  "schema_version": "datapan.institution-runtime-plan.v1",
  "generated_at": "2026-07-04T06:39:24Z",
  "provider": "data.go.kr",
  "source_id": "data_go_kr",
  "generation_inputs": {
    "coverage_backlog": "reports/data-go-kr/coverage-backlog.json",
    "registry": "data/data-go-kr.registry.json",
    "latest_verification": "reports/latest-verification.json"
  },
  "policy": {
    "selection": "highest_priority_runtime_reactivation_institutions",
    "kind": "data_go_kr_gateway",
    "batch_size": 100,
    "institution_limit": 10,
    "timeout": "20s",
    "credential_required": true,
    "credential_note": "data.go.kr gateway verification requires a service key; no-key runs only prove parameter readiness."
  },
  "summary": {
    "institutions": 411,
    "planned_institutions": 10,
    "planned_operations": 1000,
    "runtime_reactivation_api_count": 7620,
    "uncovered_api_count": 473,
    "first_queue": "행정안전부"
  },
  "batches": [
    {
      "rank": 1,
      "label": "institution-01",
      "organization": "행정안전부",
      "kind": "data_go_kr_gateway",
      "api_count": 1252,
      "covered_api_count": 1252,
      "uncovered_api_count": 0,
      "operation_count": 1767,
      "runtime_evidence_api_count": 119,
      "runtime_reactivation_api_count": 1133,
      "runtime_missing_evidence_count": 1570,
      "approval_required_operations": 613,
      "priority_score": 1133,
      "planned_operations": 100,
      "credential_required": true,
      "command": "datapan catalog verify --registry data/data-go-kr.registry.json --org '행정안전부' --kind data_go_kr_gateway --exclude-input reports/latest-verification.json --limit 100 --timeout 20s --output reports/data-go-kr/institution-batches/institution-01.json --json",
      "output": "reports/data-go-kr/institution-batches/institution-01.json"
    },
    {
      "rank": 2,
      "label": "institution-02",
      "organization": "경기도",
      "kind": "data_go_kr_gateway",
      "api_count": 840,
      "covered_api_count": 840,
      "uncovered_api_count": 0,
      "operation_count": 2241,
      "runtime_evidence_api_count": 202,
      "runtime_reactivation_api_count": 638,
      "runtime_missing_evidence_count": 1753,
      "approval_required_operations": 32,
      "priority_score": 638,
      "planned_operations": 100,
      "credential_required": true,
      "command": "datapan catalog verify --registry data/data-go-kr.registry.json --org '경기도' --kind data_go_kr_gateway --exclude-input reports/latest-verification.json --limit 100 --timeout 20s --output reports/data-go-kr/institution-batches/institution-02.json --json",
      "output": "reports/data-go-kr/institution-batches/institution-02.json"
    },
    {
      "rank": 3,
      "label": "institution-03",
      "organization": "식품의약품안전처",
      "kind": "data_go_kr_gateway",
      "api_count": 392,
      "covered_api_count": 392,
      "uncovered_api_count": 0,
      "operation_count": 648,
      "runtime_evidence_api_count": 64,
      "runtime_reactivation_api_count": 328,
      "runtime_missing_evidence_count": 517,
      "approval_required_operations": 515,
      "priority_score": 328,
      "planned_operations": 100,
      "credential_required": true,
      "command": "datapan catalog verify --registry data/data-go-kr.registry.json --org '식품의약품안전처' --kind data_go_kr_gateway --exclude-input reports/latest-verification.json --limit 100 --timeout 20s --output reports/data-go-kr/institution-batches/institution-03.json --json",
      "output": "reports/data-go-kr/institution-batches/institution-03.json"
    },
    {
      "rank": 4,
      "label": "institution-04",
      "organization": "국토교통부",
      "kind": "data_go_kr_gateway",
      "api_count": 393,
      "covered_api_count": 393,
      "uncovered_api_count": 0,
      "operation_count": 1055,
      "runtime_evidence_api_count": 119,
      "runtime_reactivation_api_count": 274,
      "runtime_missing_evidence_count": 698,
      "approval_required_operations": 258,
      "priority_score": 274,
      "planned_operations": 100,
      "credential_required": true,
      "command": "datapan catalog verify --registry data/data-go-kr.registry.json --org '국토교통부' --kind data_go_kr_gateway --exclude-input reports/latest-verification.json --limit 100 --timeout 20s --output reports/data-go-kr/institution-batches/institution-04.json --json",
      "output": "reports/data-go-kr/institution-batches/institution-04.json"
    },
    {
      "rank": 5,
      "label": "institution-05",
      "organization": "국회 국회사무처",
      "kind": "data_go_kr_gateway",
      "api_count": 277,
      "covered_api_count": 277,
      "uncovered_api_count": 0,
      "operation_count": 277,
      "runtime_evidence_api_count": 30,
      "runtime_reactivation_api_count": 247,
      "runtime_missing_evidence_count": 247,
      "approval_required_operations": 277,
      "priority_score": 247,
      "planned_operations": 100,
      "credential_required": true,
      "command": "datapan catalog verify --registry data/data-go-kr.registry.json --org '국회 국회사무처' --kind data_go_kr_gateway --exclude-input reports/latest-verification.json --limit 100 --timeout 20s --output reports/data-go-kr/institution-batches/institution-05.json --json",
      "output": "reports/data-go-kr/institution-batches/institution-05.json"
    },
    {
      "rank": 6,
      "label": "institution-06",
      "organization": "성평등가족부",
      "kind": "data_go_kr_gateway",
      "api_count": 273,
      "covered_api_count": 273,
      "uncovered_api_count": 0,
      "operation_count": 348,
      "runtime_evidence_api_count": 33,
      "runtime_reactivation_api_count": 240,
      "runtime_missing_evidence_count": 269,
      "approval_required_operations": 0,
      "priority_score": 240,
      "planned_operations": 100,
      "credential_required": true,
      "command": "datapan catalog verify --registry data/data-go-kr.registry.json --org '성평등가족부' --kind data_go_kr_gateway --exclude-input reports/latest-verification.json --limit 100 --timeout 20s --output reports/data-go-kr/institution-batches/institution-06.json --json",
      "output": "reports/data-go-kr/institution-batches/institution-06.json"
    },
    {
      "rank": 7,
      "label": "institution-07",
      "organization": "공정거래위원회",
      "kind": "data_go_kr_gateway",
      "api_count": 250,
      "covered_api_count": 250,
      "uncovered_api_count": 0,
      "operation_count": 353,
      "runtime_evidence_api_count": 18,
      "runtime_reactivation_api_count": 232,
      "runtime_missing_evidence_count": 327,
      "approval_required_operations": 301,
      "priority_score": 232,
      "planned_operations": 100,
      "credential_required": true,
      "command": "datapan catalog verify --registry data/data-go-kr.registry.json --org '공정거래위원회' --kind data_go_kr_gateway --exclude-input reports/latest-verification.json --limit 100 --timeout 20s --output reports/data-go-kr/institution-batches/institution-07.json --json",
      "output": "reports/data-go-kr/institution-batches/institution-07.json"
    },
    {
      "rank": 8,
      "label": "institution-08",
      "organization": "한국마사회",
      "kind": "data_go_kr_gateway",
      "api_count": 223,
      "covered_api_count": 223,
      "uncovered_api_count": 0,
      "operation_count": 223,
      "runtime_evidence_api_count": 15,
      "runtime_reactivation_api_count": 208,
      "runtime_missing_evidence_count": 208,
      "approval_required_operations": 221,
      "priority_score": 208,
      "planned_operations": 100,
      "credential_required": true,
      "command": "datapan catalog verify --registry data/data-go-kr.registry.json --org '한국마사회' --kind data_go_kr_gateway --exclude-input reports/latest-verification.json --limit 100 --timeout 20s --output reports/data-go-kr/institution-batches/institution-08.json --json",
      "output": "reports/data-go-kr/institution-batches/institution-08.json"
    },
    {
      "rank": 9,
      "label": "institution-09",
      "organization": "부산광역시",
      "kind": "data_go_kr_gateway",
      "api_count": 259,
      "covered_api_count": 259,
      "uncovered_api_count": 0,
      "operation_count": 336,
      "runtime_evidence_api_count": 72,
      "runtime_reactivation_api_count": 187,
      "runtime_missing_evidence_count": 248,
      "approval_required_operations": 74,
      "priority_score": 187,
      "planned_operations": 100,
      "credential_required": true,
      "command": "datapan catalog verify --registry data/data-go-kr.registry.json --org '부산광역시' --kind data_go_kr_gateway --exclude-input reports/latest-verification.json --limit 100 --timeout 20s --output reports/data-go-kr/institution-batches/institution-09.json --json",
      "output": "reports/data-go-kr/institution-batches/institution-09.json"
    },
    {
      "rank": 10,
      "label": "institution-10",
      "organization": "법제처",
      "kind": "data_go_kr_gateway",
      "api_count": 203,
      "covered_api_count": 203,
      "uncovered_api_count": 0,
      "operation_count": 403,
      "runtime_evidence_api_count": 33,
      "runtime_reactivation_api_count": 170,
      "runtime_missing_evidence_count": 285,
      "approval_required_operations": 154,
      "priority_score": 170,
      "planned_operations": 100,
      "credential_required": true,
      "command": "datapan catalog verify --registry data/data-go-kr.registry.json --org '법제처' --kind data_go_kr_gateway --exclude-input reports/latest-verification.json --limit 100 --timeout 20s --output reports/data-go-kr/institution-batches/institution-10.json --json",
      "output": "reports/data-go-kr/institution-batches/institution-10.json"
    }
  ],
  "next": [
    {
      "label": "merge",
      "command": "datapan catalog verify merge --input reports/latest-verification.json --input <completed-institution-batch.json> --output reports/latest-verification.json --json"
    },
    {
      "label": "refresh",
      "commands": [